Breast Cancer Prediction using Feature Selection and Ensemble Voting;4
Breast Cancer Prognosis Using Stacking Ensemble;3
Breast cancer prognostics using multi-omics data;1
Breast Cancer Recurrence Prediction in Biopsy Using Machine Learning Framework;1
Breast Cancer Risk Assessment Prediction Using an Ensemble Classifier;2
Breast Mass Tumor Classification from Mammograms Using Deep Learning;1
Breast tumor classification using an ensemble machine learning method;1
Bridge Seismic Damage Assessment Model Applying Artificial Neural Networks and the Random Forest Algorithm;3
Bridging learning analytics and Cognitive Computing for Big Data classification in micro-learning video collections;1
Bridging the gap between linked open data-based recommender systems and distributed representations;1
Bridging the semantic gap: Human factors in anomaly-based intrusion detection systems;2
Bucketization based Flow Classification Algorithm for Data Stream Privacy Mining;21
Bug localization with semantic and structural features using convolutional neural network and cascade forest;1
Building a classi?cation engine for ticket routing in IT support systems;3
Building a Diverse Ensemble for Classification;1
Building a Model for finding Quality of Affirmation in a Discussion Forum;1
Building a Predictive Model of Toxicity;1
Building a search engine for computer science course syllabi;3
Building an efficient intrusion detection system based on feature selection and ensemble classifier;4
Building an ensemble classifier using ensemble margin. Application to image classification;1
Building an Ensemble of Fine-Tuned Naive Bayesian Classifiers for Text Classification;1
Building an Ensemble of Naive Bayes Classifiers using Committee of Bootstraps and Monte Carlo splits for a various percentage of random objects from training set.;3
Building auto-encoder intrusion detection system based on random forest feature selection;3
Building Diversified Multiple Trees for classification in high dimensional noisy biomedical data;4
Building Energy-efficient Edge Systems;3
Building feedforward neural networks with random weights for large scale datasets;3
Building forests of local trees;1
Building machine learning and deep learning models on Google cloud platform;1
Building Machine Learning and Deep Learning Models on Google Cloud Platform: A Comprehensive Guide for Beginners;1
Building machine learning models without sharing patient data: A simulation-based analysis of distributed learning by ensembling;1
Building Occupancy Estimation using Supervised Learning Techniques;1
Building Personal Chronicle of Life Events;4
Building pipelines for educational data using AI and multimodal analytics: A ?grey?box? approach;3
Burst Detection in Social Media Communities;1
BUS LINE TRAJECTORIES CLASSIFICATION USING WEIGHTLESS NEURAL NETWORKS;4
BUSH ENCROACHMENT MONITORING USING MULTI-TEMPORAL LANDSAT DATA AND RANDOM FORESTS.;1
Business analytics;2
Business Analytics Applications for Consumer Credits;2
Business competitive analysis using promoted post detection on social media;9
Business Intelligence and Analytics;8
Calculating feature importance in data streams with concept drift using Online Random Forest;22
Calculation Methods for Binary Classification based on Discrete Data. An Application on Synthetic and Real Data.;3
Calculation of phase fraction in steel microstructure images using random forest classifier;1
Calibrated ensemble forecasts using quantile regression forests and ensemble model output statistics;1
Calibrating ensemble forecasting models with sparse data in the social sciences;3
Can board diversity predict the risk of financial distress?;3
Can deep learning predict risky retail investors? A case study in financial risk behavior forecasting;10
Can diversity amongst learners improve online object tracking?;10
Can the Immune System Perform a t-Test?;1
Can we predict stressful technical interview settings through eye-tracking?;1
Can We Predict Student Learning Performance from LMS Data? A Classification Approach;4
Cancer classification based on support vector machine optimized by particle swarm optimization and artificial bee colony;1
Cancer diagnosis through a tandem of classifiers for digitized histopathological slides;2
Candidate reassignment prediction;4
CAPHAR: context-aware personalized human activity recognition using associative learning in smart environments;3
Capsule endoscopy images classification by random forests and ferns;4
CAPTURE: Cyberattack Forecasting Using Non-Stationary Features with Time Lags;1
Cardiac anomaly detection based on time and frequency domain features using tree-based classifiers;4
Cardiac Arrhythmia Classification Using Machine Learning Techniques;4
Cardiac Cohort Classification based on Morphologic and Hemodynamic Parameters extracted from 4D PC-MRI Data;1
Cardiotocogram Data Classification Using Random Forest Based Machine Learning Algorithm;1
Cardiovascular disease risk prediction using automated machine learning: A prospective study of 423,604 UK Biobank participants;1
Cardiovascular risk prediction method based on CFS subset evaluation and random forest classification framework;1
Cartel: A system for collaborative transfer learning at the edge;10
CASCADED PROPENSITY MATCHED FRAUD MINER: DETECTING ANOMALIES IN MEDICARE BIG DATA;1
Cascaded random forest for hyperspectral image classification;1
Case-basedensemble selection for the classification of imbalanceddatasets;1
Case?only trees and random forests for exploring genotype?specific treatment effects in randomized clinical trials with dichotomous end points;1
Casting random forests as artificial neural networks (and profiting from it);1
Catch the fraudster: The development of a machine learning based fraud filter;9
Catching them red-handed: Real-time Aggression Detection on Social Media;30
Categorizing feature selection methods for multi-label classification;3
Causal inference methods for combining randomized trials and observational studies: a review;1
Centralized student performance prediction in large courses based on low-cost variables in an institutional context;3
Centrifuge Fault Diagnosis Method Based on Random Forests Algorithm;1
Cervical cancer detection and classification from pap smear images;1
Cervical Cancer Diagnosis based on Random Forest.;2
Chade: Metalearning with classifier chains for dynamic combination of classifiers;4
CHAITANYA BHARATHI INSTITUTE OF TECHNOLOGY (A);1
Challenges and opportunities for phasor data based event detection in transmission control centers under cyber security constraints;1
Challenges and Solutions to the Student Dropout Prediction Problem in Online Courses;1
Challenges in benchmarking stream learning algorithms with real-world data;36
Challenges in deploying machine learning: a survey of case studies;1
Challenges in Learning from Streaming Data Extended Abstract;22
Challenges in predicting community periodontal index from hospital dental care records;3
Challenges of Big Data technologies in education process in Business information systems;1
Challenges of data management and analytics in omni-channel CRM;2
Challenges of Stream Learning for Predictive Maintenance in the Railway Sector;34
Champion-challenger analysis for credit card fraud detection: hybrid ensemble and deep learning;35
Change Detection and Prognostics for Transient Real-World Processes Using Streaming Data;3
Change Mining and Analysis for Data Streams;20
Change-aware build prediction model for stall avoidance in continuous integration;5
Chapter 9: Characterization and Prediction of Human Protein-Protein Interactions;2
Characterization and prediction of air traffic delays;1
Characterization of coronary plaque regions in intravascular ultrasound images using a hybrid ensemble classifier;1
Characterizing and predicting blocking bugs in open source projects;2
Characterizing disk health degradation and proactively protecting against disk failures for reliable storage systems;1
Characterizing Student Engagement Moods for Dropout Prediction in Question Pool Websites;3
Chatbot Interaction with Artificial Intelligence: Human Data Augmentation with T5 and Language Transformer Ensemble for Text Classification;1
Chemoinformatic classification methods and their applicability domain;1
Choice modelling in the age of machine learning;1
Choosing an accurate number of mel frequency cepstral coefficients for audio classification purpose;4
Choosing an appropriate ensemble classifier for balanced bioinformatics data;3
Choosing the Best Algorithm for an Incremental On-line Learning Task;20
Choosing the Best Sensor Fusion Method: A Machine-Learning Approach;3
Chronic diseases diagnosis using machine learning;2
Chronic eye disease diagnosis using ensemble-based classifier;3
Chronic Kidney Disease stratification using office visit records: Handling data imbalance via hierarchical meta-classification;3
Chronic liver disease classification using hybrid whale optimization with simulated annealing and ensemble classifier;1
Chrysanthemum Abnormal Petal Type Classification using Random Forest and Over-sampling;1
Churn Analysis in Telecommunication Industry;3
Churn Prediction;1
Churn Prediction and Causal Analysis on Telecom Customer Data;7
Churn prediction in customer relationship management via GMDH-based multiple classifiers ensemble;1
Churn prediction in subscriber management for mobile and wireless communications services;4
Churn prediction in telecommunication using machine learning;1
Churn prediction system for telecom using filter?wrapper and ensemble classification;4
CIA evasion attacks transferability between machine learning models;9
CICIDS-2017 dataset feature analysis with information gain for anomaly detection;2
Citance-based retrieval and summarization using IR and machine learning;1
CLASS BINARIZATION WITH SELF-ADAPTIVE ALGORITHM TO IMPROVE HUMAN ACTIVITY RECOGNITION;5
Class Boundary Exemplar Selection Based Incremental Learning for Automatic Target Recognition;1
Class imbalance ensemble learning based on the margin theory;10
Class Imbalance Learning in Data Mining?A Survey;1
Class imbalance problem using a hybrid ensemble approach;1
Class weights random forest algorithm for processing class imbalanced medical data;4
Classical and Deep Learning Paradigms for Detection and Validation of Key Genes of Risky Outcomes of HCV;3
Classication Of Land-Cover Through Machine Learning Algorithms For Fusion Of Sentinel-2a And Planetscope Imagery;1
Classifica‡Æo de esportes em v¡deos amadores e profissionais;1
Classification active de flux de documents avec identification des nouvelles classes;1
Classification Algorithms in Data Mining?A Survey;1
Classification Algorithms of Data Mining Applied for Demographic Processes;1
Classification analysis of DNA microarrays;1
Classification and Analysis of High Dimensional Datasets using Clustering and Decision tree;2
Classification and assessment of power system static security using decision tree and random forest classifiers;3
Classification and biomarker genes selection for cancer gene expression data using random forest;1
Classification and Clustering;3
Classification and Clustering of Paediatric Cancers;1
Classification and Detection of Arrhythmia in ECG Signal Using Machine Learning Techniques;1
Classification and interaction in random forests;1
Classification and its applications for drug-target interaction identification;2
Classification and location extraction of harmful algal blooms from microblogs;1
Classification and outlier detection based on topic based pattern synthesis;2
Classification and prediction of diabetes disease using machine learning paradigm;3
Classification and predictive analysis of educational data to improve the quality of distance learning courses;1
Classification and Quantification of Retinal Cysts in OCT B-Scans: Efficacy of Machine Learning Methods;3
Classification and Recommendation With Data Streams;9
Classification and regression with random forests as a standard method for presence-only data SDMs: A future conservation example using China tree species;1
Classification Application Based on Mutual Information and Random Forest Method for High Dimensional Data;2
Classification based on prediction of accuracy of multiple data models;3
Classification based Performance analysis using Na‹ve-Bayes J48 and Random forest algorithms;1
Classification de flux de documents ‚volutifs avec apprentissage de classes inconnues;1
Classification d'‚v‚nements … partir de capteurs sols-Application au suivi de personnes fragiles.;1
Classification in the presence of label noise: a survey;3
Classification Methods for Internet Applications;1
Classification model for hotspot sequences as indicator for peatland fires using data mining approach;1
Classification models for heart disease prediction using feature selection and PCA;1
Classification of acoustical signals by combining active learning strategies with semi-supervised learning schemes;3
Classification of agricultural soil parameters in India;1
Classification of Ancient Epigraphs into different periods using Random Forests;1
Classification of ball bearing faults using a hybrid intelligent model;1
Classification of Binary Class HIV/AIDS Test Results Using Ensemble Learning Models;4
Classification of botnet families based on features self-learning under Network Traffic Censorship;2
Classification of cancer gene selection using random forest and neural network based ensemble classifier;1
Classification of cardiac arrhythmia by random forests with features constructed by kaizen programming with linear genetic programming;4
Classification of cardiac arrhythmia using machine learning techniques;3
Classification of cardiotocograms using random forest classifier and selection of important features from cardiotocogram signal;1
Classification of Chronic Kidney Disease with Proposed Union Based Feature Selection Technique;4
Classification of clinical outcomes using high-throughput informatics: Part 1?nonparametric method reviews;3
Classification of Complex UCI Datasets Using Machine Learning Algorithms Using Hadoop;1
Classification of complex UCI datasets using machine learning and evolutionary algorithms;1
Classification of computer viruses from binary code using ensemble classifier and recursive feature elimination;3
CLASSIFICATION OF CORONARY ARTERY DISEASES USING STACKING ENSEMBLE LEARNING METHOD;3
Classification of defects with ensemble methods in the automated visual inspection of sewer pipes;1
Classification of diffusion modes in single-particle tracking data: Feature-based versus deep-learning approach;1
Classification of enzymes using machine learning based approaches: a review;3
Classification of expansive grassland species in different growth stages based on hyperspectral and LiDAR data;1
Classification of Factors Affecting Renal Failure by Machine Learning Methods;1
Classification of Fetal Heart Rate and Thyroid Disease using Ensemble Learning Approach;1
Classification of Forest Cover Type Using Random Forests Algorithm;10
Classification of Fractal Time Series Using Recurrence Plots;1
Classification of geographic origin of rice by data mining and inductively coupled plasma mass spectrometry;1
Classification of high-dimensional evolving data streams via a resource-efficient online ensemble;37
Classification of High-resolution Remotely Sensed Images Based on Random Forests;1
Classification of Human Activity based on Sensor Accelerometer and Gyroscope Using Ensemble SVM method;1
Classification of human daily activities using ensemble methods based on smartphone inertial sensors;7
Classification of hyperspectral images using machine learning methods;4
CLASSIFICATION OF HYPERSPECTRAL IMAGES WITH ENSEMBLE LEARNING METHODS;1
Classification of Imbalanced Datasets Using Random Split Bagging Ensemble Technique;4
Classification of immunosignature using random forests for cancer diagnosis;1
Classification of internet traffic data using ensemble method;1
Classification of intraday S&P500 returns with a Random Forest;3
Classification of large datasets using Random Forest Algorithm in various applications: Survey;1
Classification of load forecasting studies by forecasting problem to select load forecasting techniques and methodologies;1
Classification of lung function on a smartphone app;1
Classification of malware families based on runtime behaviors;3
Classification of Malware Variant Based on Ensemble Learning;3
Classification of masses in digital mammograms using the genetic ensemble method;1
Classification of Medical Data Derived from Diagnostic Devices Using Ensembles of Classifiers;1
Classification of melanoma based on feature similarity measurement for codebook learning in the bag-of-features model;1
Classification of microarray cancer data using ensemble approach;4
Classification of microarray data;1
Classification of microcalcification clusters in digital mammograms using a stack generalization based classifier;3
Classification of microcalcifications using micro-CT;1
Classification of mobile services and apps through physical channel fingerprinting: a deep learning approach;2
Classification of Nucleotides Using Memetic Algorithms and Computational Methods;4
Classification of oil palm female inflorescences anthesis stages using machine learning approaches;2
Classification of Parkinson's disease based on multi-modal features and stacking ensemble learning;1
Classification of Patterns in Streaming Data Using Clustering Signatures;11
CLASSIFICATION OF PHISHING SCAM IN WEBSITE USING RANDOM FOREST, LOGISTIC REGRESSION & SUPPORT VECTOR MACHINE;3
Classification of pollen grain images based on an ensemble of classifiers;1
Classification of Positive and Negative Stimuli Using EEG Data Functional Connectivity and Machine Learning;1
Classification of pulmonary nodules by using hybrid features;4
Classification of remote sensing data using margin-based ensemble methods;1
Classification of Rheumatoid Arthritis using Machine Learning Algorithms;7
Classification of Rice Heavy Metal Stress Levels Based on Phenological Characteristics Using Remote Sensing Time-Series Images and Data Mining Algorithms;1
Classification of RNA-seq data;1
Classification of Root Causes for Wind Turbine Failures;3
Classification of soils into hydrologic groups using machine learning;1
CLASSIFICATION OF SPECT HEART DATASET USING EFFICIENT MODIFIED RANDOM FOREST ALGORITHM;1
Classification of stroke disease using machine learning algorithms;1
Classification of the Answers of the OMT;1
Classification of the excitation location of snore sounds in the upper airway by acoustic multifeature analysis;4
Classification of the glioma grading using radiomics analysis;1
Classification of Thyroid Disease: A Survey;1
Classification of Travel Modes Using Streaming GNSS Data;1
Classification of urban aerial data based on pixel labelling with deep convolutional neural networks and logistic regression;1
Classification of vessel activity in streaming data;1
Classification of VHR multispectral images using extratrees and maximally stable extremal region-guided morphological profile;3
CLASSIFICATION OF WINE DATASET USING EFFICIENT MODIFIED RANDOM FOREST ALGORITHM;1
Classification performance improvement using random subset feature selection algorithm for data mining;1
Classification Study and Prediction of Cervical Cancer;3
Classification system for mortgage arrear management;1
Classification techniques for intrusion detection-an overview;4
Classification techniques for sensor-based activity recognition in smart homes;1
Classification techniques for sentiment discovery-A review;1
"Classification techniques for the management of the"" Quality of Service"" in Satellite Communication systems";1
Classification Techniques of High Resolution Aerial Images: A Survey of Commonly AI Techniques;2
Classification Using Decision Tree Ensembles;1
Classification using rough random forest;1
Classification with costly features as a sequential decision-making problem;2
Classification with Ensemble Methods?A Review;1
"Classification with noisy labels:"" Multiple Account"" cheating detection in Open Online Courses";3
Classification-based data mining for identification of risk patterns associated with hypertension in Middle Eastern population: A 12-year longitudinal study;1
Classifier Ensemble Feature Selection for Automatic Fault Diagnosis;1
Classifier ensemble generation and selection with multiple feature representations for classification applications in computer-aided detection and diagnosis on mammography;1
Classifier ensemble reduction using a modified firefly algorithm: An empirical evaluation;10
Classifier ensembles for image identification using multi-objective Pareto features;1
Classifier fusion with contextual reliability evaluation;1
Classifier Performance and Evaluation;3
Classifier Selection and Ensemble Model for Multi-class Imbalance Learning in Education Grants Prediction;9
Classifier Set Selection for Cardiac Arrhythmia Recognition Using Diversity;1
Classifiers consensus system approach for credit scoring;3
Classifying a User as Driver or Passenger in a Vehicle Using Machine Learning;1
Classifying and counting with recurrent contexts;10
Classifying and ranking search engine results as potential sources of plagiarism;3
Classifying Botnet Attack on Internet of Things Device Using Random Forest;2
Classifying categories of SCADA attacks in a big data framework;2
Classifying Collected Sensor Data for Mental Health Prediction using General, Personalized and Hybrid Machine Learning Models;2
Classifying cultural heritage images by using decision tree classifiers in WEKA;2
Classifying gene data with regularized ensemble trees;1
Classifying Human Behaviors, Activities and Contexts from Mobile Sensor Data;8
Classifying Imbalanced Road Accident Data Using Recurring Concept Drift;11
Classifying many-class high-dimensional fingerprint datasets using random forest of oblique decision trees;4
Classifying Non-linear Gene Expression Data Using a Novel Hybrid Rotation Forest Method;1
Classifying textual data: shallow, deep and ensemble methods;1
Classifying the type of delivery from cardiotocographic signals: A machine learning approach;3
Classifying uncertain and evolving data streams with distributed extreme learning machine;20
Class-imbalanced dynamic financial distress prediction based on Adaboost-SVM ensemble combined with SMOTE and time weighting;10
Class-specific random forest with cross-correlation constraints for spectral?spatial hyperspectral image classification;1
Client-Based Intelligence for Resource Efficient Vehicular Big Data Transfer in Future 6G Network;1
Climate Classification Using Geo-Tagged Images;1
Clinical Document Classification Using Labeled and Unlabeled Data Across Hospitals;10
Clipper: A low-latency online prediction serving system;4
Closed loop supply chain waste reduction through predictive modelling and process analysis;17
Cloth Manipulation Using Random Forest-Based Controller Parametrization;1
Cloth Manipulation Using Random-Forest-Based Imitation Learning;1
Cloud Enabled Machines with Data Driven Intelligence;3
Cloud type identification using data fusion and ensemble learning;1
Cloud-based recognition of complex activities for ambient assisted living in smart homes with non-invasive sensors;4
ClowdFlows: Online workflows for distributed big data mining;11
Club-drf: A clustering approach to extreme pruning of random forests;1
Cluster ensemble based on Random Forests for genetic data;1
Cluster forest based fuzzy logic for massive data clustering;1
Cluster Forests Based Fuzzy C-Means for Data Clustering;1
Cluster-based under-sampling with random forest for multi-class imbalanced classification;2
Clustering based ensemble correlation tracking;1
Clustering Enabled Classification using Ensemble Feature Selection for Intrusion Detection;1
Clustering ensemble tracking;1
Clustering Methods for Identification of Attacks in IoT Based Traffic Signal System;3
Clustering of Pharmaceutical products using Random Forest algorithm;1
Clustering to Improve One-Class Classifier Performance in Data Streams;32
Clustering with Non-Uniform Random Forests;4
Clustering-Based Classification of Document Streams with Active Learning;1
Clustering-Based Ensemble of One-Class Classifiers for Hyperspectral Image Segmentation;1
Clustering?based real?time anomaly detection?A breakthrough in big data technologies;1
CNFE-SE: a novel approach combining complex network-based feature engineering and stacked ensemble to predict the success of intrauterine insemination and ranking the features;3
CNFE-SE: A novel hybrid approach combining complex network-based feature engineering and stacked ensemble to predict the success of Intrauterine Insemination and ranking the features;3
CNN and RNN based payload classification methods for attack detection;9
Coastal wetland classification with multiseasonal high-spatial resolution satellite imagery;1
Co-eye: a multi-resolution ensemble classifier for symbolically approximated time series;3
Cognitive analytics: Going beyond big data analytics and machine learning;21
Cognitively Inspired Rule-Plus-Exemplar based Pattern Classification;1
Cohort selection for clinical trials from longitudinal patient records: text mining approach;1
Collaboration adaptive filtering model for data reduction in wireless sensor networks;1
Collaborative analytics for data silos;8
Collaborative and continual learning for classification tasks in a society of devices;9
Collaborative decision making by ensemble rule based classification systems;4
Collaborative ensemble learning under differential privacy;10
Collaborative Ensemble-Learning Based Intrusion Detection Systems for Clouds;4
Collaborative rule generation: An ensemble learning approach;1
Collaborative tracking: Dynamically fusing short-term trackers and long-term detector;1
Collaborative training of balanced random forests for open set domain adaptation;1
