From Explaining How Random Forest Classifier Predicts Learning of Software Engineering Teamwork to Guidance for Educators;2
From intrusion detection to attacker attribution: A comprehensive survey of unsupervised methods;1
From Mobility Traces to Knowledge: Design Guidance for Intelligent Vehicular Networks;1
FTBME: feature transferring based multi-model ensemble;2
FTIR spectroscopy of biofluids revisited: an automated approach to spectral biomarker identification;1
Full-Waveform LiDAR Point Clouds Classification Based on Wavelet Support Vector Machine and Ensemble Learning;4
Fully Associative Ensemble Learning for Hierarchical Multi-Label Classification.;1
Fully Automatic Classification of Flow Cytometry Data;1
Fully convolutional networks with sequential information for robust crop and weed detection in precision farming;1
Functional assessment of retinal models using machine learning techniques/??????????? ?????????? ???????? ????????????????? ?? ????? ???????? ????????? ???????;1
Functional encryption based approaches for practical privacy-preserving machine learning;1
Fundus image classification using VGG-19 architecture with PCA and SVD;1
Fusing lidar and digital aerial photography for object-based forest mapping in the Florida Everglades;3
Fusion of BLAST and Ensemble of Classifiers for Protein Secondary Structure Prediction;1
Fusion of CNNs and statistical indicators to improve image classification;1
Fusion of HJ1B and ALOS PALSAR data for land cover classification using machine learning methods;3
Fusion of multiple indicators with ensemble incremental learning techniques for stock price forecasting;1
Fusion of Multispectral Image and Airborne LiDAR Data for the Classification of Urban Area with Rotation Forest;1
Fusion of pupil dilation and facial temperature features for detection of stress;1
Fusion techniques for activity recognition using multi-camera networks;1
Fusion-On-Field Security and Privacy Preservation for IoT Edge Devices: Concurrent Defense Against Multiple Types of Hardware Trojan Attacks;1
Future intelligent and secure vehicular network toward 6G: Machine-learning approaches;3
Fuzzy Activation of Rough Cognitive Ensembles Using OWA Operators;1
Fuzzy C-means and region growing based classification of tumor from mammograms using hybrid texture feature;3
Fuzzy integral driven ensemble classification using a priori fuzzy measures;3
Fuzzy random forest with c?fuzzy decision trees;1
Fuzzy trees and forests;4
Game data mining competition on churn prediction and survival analysis using commercial game log data;7
Garment Categorization Using Data Mining Techniques;1
Gastroenterology ontology construction using synonym identification and relation extraction;3
Gaussian mixture descriptors learner;5
Gaussian multiple instance learning approach for mapping the slums of the world using very high resolution imagery;1
Gaussian Processes for Rumour Stance Classification in Social Media;5
Gaussian-response correlation filter for robust visual object tracking;2
Gaze movement-driven random forests for query clustering in automatic video annotation;3
Gaze-enhanced student modeling for game-based learning;1
Gaze-in-wild: A dataset for studying eye and head coordination in everyday activities;2
gazeNet: End-to-end eye-movement event detection with deep neural networks;1
Gb-cent: Gradient boosted categorical embedding and numerical trees;3
GBS: Guidance by Semantics-Using High-Level Visual Inference to Improve Vision-Based Mobile Robot Localization;2
GBSVM: Sentiment Classification from Unstructured Reviews Using Ensemble Classifier;4
Gender Classification of Prepubescent Children via Eye Movements with Reading Stimuli;7
Gender Differences in Predicting STEM Choice by Affective States and Behaviors in Online Mathematical Problem Solving: Positive-Affect-to-Success Hypothesis.;1
GENE EXPRESSION DATA ANALYSIS USING DATA MINING ALGORITHMS FOR COLON CANCER;1
Gene Expression Programming as a data classification tool. A review;3
Gene selection for enhanced classification on microarray data using a weighted k-NN based algorithm;1
Gene Selection using Intelligent Dynamic Genetic Algorithm and Random Forest;1
Gene set based ensemble methods for cancer classification;3
General Temporally Biased Sampling Schemes for Online Model Management;4
Generalized fuzzy soft sets theory?based novel hybrid ensemble credit scoring model;1
Generalized inverse classification;3
Generalized linear mixed-model (GLMM) trees: A flexible decision-tree method for multilevel and longitudinal data;1
Generalized Linear Splitting Rules in Decision Forests;1
Generalized random shapelet forests;4
Generating automated forestry geoinformation products from remotely sensed imagery;1
Generating Icons for Applications in an Applications Marketplace;1
Generating Punctuation for Spoken Text;1
Generating Trading Signals by ML algorithms or time series ones?;1
Generating Travel Itineraries Based on Travel History of Similar Users;1
Generating Travel Itineraries Based on User Interests;1
Generating Tree-Level Harvest Predictions from Forest Inventories with Random Forests;1
Generation of structure function based on ambiguous and incompletely specified data using fuzzy random forest;2
Generative data models for validation and evaluation of visualization techniques;2
Genetic Adversarial Training of Decision Trees;2
Genetic programming as a feature selection algorithm;1
Genetic programming based ensemble system for microarray data classification;1
Genome mining using machine learning techniques;1
GenomeForest: An Ensemble Machine Learning Classifier for Endometriosis;3
Genome-wide association data classification and SNPs selection using two-stage quality-based Random Forests;1
Geographic Object-Based Image Analysis Framework for Mapping Vegetation Physiognomic Types at Fine Scales in Neotropical Savannas;1
Geological mapping in western Tasmania using radar and random forests;4
Geological mapping using remote sensing data: A comparison of five machine learning algorithms, their response to variations in the spatial distribution of training data and the use of explicit spatial information;1
Geometric Accuracy Prediction and Improvement for Additive Manufacturing Using Triangular Mesh Shape Data;1
Geospatial Big Data Handling Theory and Methods: A Review and Research Challenges;2
Geospatial data mining for digital raster mapping;5
Geospatial Data Science Techniques and Applications;1
GEP-based classifier for mining imbalanced data;33
Geriatric depression symptoms coexisting with cognitive decline: a comparison of classification methodologies;3
Gesture recognition system for real-time mobile robot control based on inertial sensors and motion strings;2
Getting Passive Aggressive About False Positives: Patching Deployed Malware Detectors;1
GFD: A Weighted Heterogeneous Graph Embedding Based Approach for Fraud Detection in Mobile Advertising;3
ggRandomForests: Survival with Random Forests;1
Ghost Peppers: Using Ensemble Models to Detect Professor Attractiveness Commentary on RateMyProfessors. com;1
GIS-based ensemble soft computing models for landslide susceptibility mapping;1
GIS-based evaluation of landslide susceptibility models using certainty factors and functional trees-based ensemble techniques;1
GIS-based groundwater potential mapping in Shahroud plain, Iran. A comparison among statistical (bivariate and multivariate), data mining and MCDM approaches;1
Gis-based gully erosion susceptibility mapping: A comparison of computational ensemble data mining models;4
GIS-based landslide susceptibility mapping using numerical risk factor bivariate model and its ensemble with linear multivariate regression and boosted regression tree algorithms;1
GIS-based modeling of rainfall-induced landslides using data mining-based functional trees classifier with AdaBoost, Bagging, and MultiBoost ensemble frameworks;4
GIS-Based Surface Water Changing Analysis in Rajshahi City Corporation;3
GIS-Based Surface Water Changing Analysis in Rajshahi City Corporation Area Using Ensemble Classifier;3
GLCM based Improved Mammogram Classification using Associative Classifier.;3
Gleaning knowledge from data in the intensive care unit;2
GLIMPSE: a glioblastoma prognostication model using ensemble learning?a surveillance, epidemiology, and end results study;1
Global and local features based medical image classification;1
Global multi-output decision trees for interaction prediction;2
Global optimization ensemble model for classification methods;1
Global refinement of random forest;1
Go for Broke: Maximizing Performance in Clustered and GPU Environments;7
Goal-based learning in tactile robotics;1
Going Watson on MNIST;1
Going-concern prediction using hybrid random forests and rough set approach;1
GOOWE: Geometrically Optimum and Online-Weighted Ensemble classifier for evolving data streams;92
GPU-based State Adaptive Random Forest for Evolving Data Streams;19
Gpu-oriented stream data mining traffic classification;5
Gradient boosting as a SNP filter: An evaluation using simulated and hair morphology data;3
Gradient boosting in automatic machine learning: feature selection and hyperparameter optimization;4
Gradient Correlation: Are Ensemble Classifiers More Robust Against Evasion Attacks in Practical Settings?;3
Granada (SPAIN);5
Granular Computing Based Machine Learning;5
Granular computing based machine learning: a big data processing approach;5
Granular computing-based approach for classification towards reduction of bias in ensemble learning;1
Graph embedded rules for explainable predictions in data streams;34
Graph embeddings on protein interaction networks;1
Graph input representations for machine learning applications in urban network analysis;1
Graph Model Selection via Random Walks;1
Graph stream classification using labeled and unlabeled graphs;11
Grasshopper optimization algorithm?based approach for the optimization of ensemble classifier and feature selection to classify epileptic EEG signals;1
Green Accelerated Hoeffding Tree;19
Ground-based Tree Image Data Mining for Phenology Research;1
Groundwater aquifer potential modeling using an ensemble multi-adoptive boosting logistic regression technique;3
Groundwater potential mapping using a novel data-mining ensemble model;1
Groundwater potential mapping using an integrated ensemble of three bivariate statistical models with random forest and logistic model tree models;1
Groundwater potential zones for sustainable management plans in a river basin of India and Bangladesh;3
Groundwater spring potential assessment using new ensemble data mining techniques;4
Group feature selection via structural sparse logistic regression for ids;4
Growing Adaptive Multi-Hyperplane Machines;1
GTC Forest: An Ensemble Method for Network Structured Data Classification;1
GuessUNeed: Recommending Courses via Neural Attention Network and Course Prerequisite Relation Embeddings;1
Guidance on and comparison of machine learning classifiers for Landsat-based land cover and land use mapping;3
GUIDE: a scalable information directory service to collect, federate, and analyze logs for operational insights into a leadership HPC facility;2
Guided Random Forest and its application to data approximation;1
Gully head-cut distribution modeling using machine learning methods?A case study of nw iran;3
Habitat classification using random forest based image annotation;1
Habitat image annotation with low-level features, medium-level knowledge and location information;3
Hand Pose Recognition Using Local Binary Patterns and Random Forests Classifier;1
Handling concept drift via model reuse;57
Handling imbalanced data in road crash severity prediction by machine learning algorithms;1
Handling uncertainty in social lending credit risk prediction with a choquet fuzzy integral model;3
Hands-on machine learning with Scikit-Learn and TensorFlow: concepts, tools, and techniques to build intelligent systems;3
Hands-on machine learning with Scikit-Learn, Keras, and TensorFlow: Concepts, tools, and techniques to build intelligent systems;3
Hands-On Transfer Learning with Python: Implement advanced deep learning and neural network models using TensorFlow and Keras;3
Hands-On Unsupervised Learning Using Python: How to Build Applied Machine Learning Solutions from Unlabeled Data;3
Hard-ODT: Hardware-Friendly Online Decision Tree Learning Algorithm and System;32
Hardware architecture for learning Random Forests/submitted by David Hackl, BSc;1
Hardware implementation of a decision tree classifier for object recognition applications;3
Harmonizing Wearable Biosensor Data Streams to Test Polysubstance Detection;3
Hate speech, machine classification and statistical modelling of information flows on twitter: Interpretation and communication for policy decision making;3
Having a blast: Meta-learning and heterogeneous ensembles for data streams;21
HBoost: A heterogeneous ensemble classifier based on the Boosting method and entropy measurement;3
HDDse: Enabling High-Dimensional Disk State Embedding for Generic Failure Detection System of Heterogeneous Disks in Large Data Centers;3
HDM-Analyser: a hybrid analysis approach based on data mining techniques for malware detection;2
HDSM: A distributed data mining approach to classifying vertically distributed data streams;34
Head-cut gully erosion susceptibility modelling based on ensemble Random Forest with oblique decision trees in Fareghan watershed, Iran;3
Health big data analytics: A technology survey;1
HEAR: Fog-Enabled Energy-Aware Online Human Eating Activity Recognition;1
Heart Block Prediction using Data mining and Machine Learning;3
Heart disease classification: A case study using machine learning and data mining;4
Heart Disease Diagnosis and Prediction Using Machine Learning and Data Mining Techniques: A Review;19
Heart Disease Diagnosis Using Machine Learning;2
Heart disease diagnosis using predictive data mining;1
HEART DISEASE PREDICTION USING DATA MINING.;2
Heart Disease Prediction Using Hybrid Technique;2
Heart Diseases Diagnosis Using Artificial Neural Networks;7
Heart Sound Classification for Murmur Abnormality Detection Using an Ensemble Approach Based on Traditional Classifiers and Feature Sets;3
Heavy log reader: learning the context of cyber attacks automatically with paragraph vector;3
Heavy metal contamination prediction using ensemble model: Case study of Bay sedimentation, Australia;1
Hellinger net: A hybrid imbalance learning model to improve software defect prediction;6
HeMA: A Hierarchically Enriched Machine Learning Approach for Managing False Alarms in Real Time: A Sepsis Prediction Case Study;1
Hep-2 cell classification using multi-dimensional local binary patterns and ensemble classification;1
Herramientas avanzadas de an lisis de datos de aplicaci¢n en ingenier¡a civil: Machine Learning using Python;1
Heterogeneous Ensemble for Imaginary Scene Classification.;1
Heterogeneous ensemble learning with feature engineering for default prediction in peer-to-peer lending in China;3
Heterogeneous ensemble selection for evolving data streams;34
Heterogeneous features and model selection for event-based media classification;3
Heterogeneous Model Reuse via Optimizing Multiparty Multiclass Margin;4
Heterogeneous oblique random forest;1
HIBAG?HLA genotype imputation with attribute bagging;1
Hidden Risks of Machine Learning Applied to Healthcare: Unintended Feedback Loops Between Models and Future Data Causing Model Degradation;4
Hidost: a static machine-learning-based detector of malicious files;6
Hierarchical Bayesian Classifier Combination;3
Hierarchical classification method based on selective learning of slacked hierarchy for activity recognition systems;1
Hierarchical Classification of Diatom Images with Transfer Learning;1
Hierarchical classification of protein folds using a novel ensemble classifier;1
Hierarchical Gradient Smoothing for Probability Estimation Trees;1
Hierarchical intrusion detection using machine learning and knowledge model;4
Hierarchical mixing linear support vector machines for nonlinear classification;3
Hierarchical modeling using automated sub-clustering for sound event recognition;1
Hierarchical multi-label classification using fully associative ensemble learning;1
Hierarchical retinal blood vessel segmentation based on feature and ensemble learning;4
Hierarchical single label classification: An alternative approach;3
Hierarchical spatio-temporal pattern discovery and predictive modeling;7
High accuracy android malware detection using ensemble learning;1
High accuracy detection of collaboration from log data and superficial speech features;2
High accuracy-priority rule extraction for reconciling accuracy and interpretability in credit scoring;2
High dimensional low sample size activity recognition using geometric classifiers;3
High Entropy Ensembles for Holistic Figure-ground Segmentation.;1
High Level Synthesis of CART;3
High Performance Machine Learning through Codesign and Rooflining;1
High precision coding in mouse visual cortex;1
High Precision Medicine Bottles Vision Online Inspection System and Classification Based on Multi-Features and Ensemble Learning via Independence Test;1
High resolution sentiment analysis by ensemble classification;8
High-dimensional data classification;3
High-Dimensional Limited-Sample Biomedical Data Classification Using Variational Autoencoder;6
High-Dimensional Outlier Detection: The Subspace Method;1
Higher order dynamic conditional random fields ensemble for crop type classification in radar images;3
Highly Reliable Hepatitis diagnosis with multi classifiers;1
High-Performance Computing Evaluation of Supervised Learning Models and Human Expert Criteria for Stock Screening Using Fundamental Factors;3
High-Resolution Remote Sensing Imagery Classification of Imbalanced Data Using Multistage Sampling Method and Deep Neural Networks;1
High-voltage circuit breaker fault diagnosis using a hybrid feature transformation approach based on random forest and stacked autoencoder;1
High-Voltage Circuit Breaker Fault Diagnosis Using a Hybrid Feature Transformation Approach Based on Random Forest and Stacked Auto-Encoder;1
Hippocampus subfield segmentation using a patch-based boosted ensemble of autocontext neural networks;1
hi-RF: Incremental Learning Random Forest for large-scale multi-class Data Classification;1
HITSZ-ICRC: Exploiting classification approach for answer selection in community question answering;1
HJB-Equation-Based Optimal Learning Scheme for Neural Networks With Applications in Brain?Computer Interface;1
HLPI-ensemble: prediction of human lncRNA-protein interactions based on ensemble strategy;1
Hobbit, a care robot supporting independent living at home: First prototype and lessons learned;1
Hoeffding tree algorithms for anomaly detection in streaming datasets: A survey;21
Hoeffding-Tree-Based Learning from Data Streams and Its Application in Online Voltage Security Assessment;16
HOLMES: Health OnLine Model Ensemble Serving for Deep Learning Models in Intensive Care Units;3
Homogeneous and heterogeneous ensemble classification methods in diabetes disease: a review;1
Homogeneous Clustering Based Ensemble Classifier;1
Horseshoe RuleFit: Learning Rule Ensembles via Bayesian Regularization;3
Host-based anomaly detection using Eigentraces feature extraction and one-class classification on system call trace data;3
Hough-Based Tracking of Deformable Objects;1
Hough-based tracking of non-rigid objects;1
Hour-ahead wind power forecast based on random forests;4
HOUSE PRICE PREDICTION;1
How are maths-anxious students identified and what are the key predictors of maths anxiety? Insights gained from PISA results for Korean adolescents;1
How can lenders prosper? Comparing machine learning approaches to identify profitable peer-to-peer loan investments;1
How can Machine Learning Support the Practice of Modeling and Simulation??A Review and Directions for Future Research;1
How Data Science Happens;5
How do organizations prepare and clean Big Data to achieve better data governance? A Delphi Study;1
How Do Your Neighbors Disclose Your Information: Social-Aware Time Series Imputation;1
How good is my feedback? a content analysis of written feedback;1
How large should ensembles of classifiers be?;3
How Machine Learning Can Support Cyberattack Detection in Smart Grids;29
How much does word sense disambiguation help in sentiment analysis of micropost data?;1
How Socioeconomic Factors Influence Performance: A Data-Driven Analysis;1
How to train your dragon: best practices in pedestrian classifier training;2
How well do deep learning-based methods for land cover classification and object detection perform on high resolution remote sensing imagery?;1
How Widely Can Prediction Models be Generalized? An Analysis of Performance Prediction in Blended Courses;1
How Widely Can Prediction Models be Generalized? An Analysis of Performance Prediction in Blended Courses.;1
How widely can prediction models be generalized? Performance prediction in blended courses;1
HRFuzzy: Holoentropy-enabled rough fuzzy classifier for evolving data streams;54
Human action recognition in still images using action poselets and a two-layer classification model;1
Human action recognition using adaptive local motion descriptor in spark;2
Human Activities Recognition: a Transfer Learning Approach;9
Human activity recognition using ensemble modelling;1
Human activity recognition using machine learning methods in a smart healthcare environment;2
Human and artificial intelligence in decision systems for social development;1
Human context recognition with reduced feature space vectors for resource constraint gadgets;1
Human daily activity recognition with wearable sensors based on incremental learning;1
Human decision making and artificial intelligence: a comparison in the domain of sports prediction;2
Human factors in model interpretability: Industry practices, challenges, and needs;1
Human gesture classification by brute-force machine learning for exergaming in physiotherapy;1
Human Motion Gesture Recognition Algorithm in Video Based on Convolutional Neural Features of Training Images;2
Human perception capabilities for socially intelligent domestic service robots;2
Human tracking in thermal images using adaptive particle filters with online random forest learning;4
Human-interpretable feature pattern classification system using learning classifier systems;1
Hunting Malicious TLS Certificates with Deep Neural Networks;1
HybLoc: Hybrid indoor Wi-Fi localization using soft clustering-based random decision forest ensembles;1
Hybrid adaptive classifier ensemble;3
Hybrid algorithmic approach oriented to incipient rotor fault diagnosis on induction motors;1
Hybrid Approach for Intrusion Detection Model Using Combination of K-Means Clustering Algorithm and Random Forest Classification;1
Hybrid approach to improving the results of the SVM classification using the Random Forest algorithm;1
Hybrid Architecture for Distributed Intrusion Detection System.;2
Hybrid artificial intelligence approach based on neural fuzzy inference model and metaheuristic optimization for flood susceptibilitgy modeling in a high-frequency tropical cyclone area using GIS;1
Hybrid biogeography based simultaneous feature selection and MHC class I peptide binding prediction using support vector machines and random forests;1
Hybrid Classification Algorithms For Terrorism Prediction in Middle East and North Africa;22
Hybrid classification and regression models via particle swarm optimization auto associative neural network based nonlinear PCA;3
Hybrid Classification of High-Dimensional Biomedical Tumour Datasets;4
Hybrid classifier ensemble for imbalanced data;4
Hybrid computational intelligence models for improvement gully erosion assessment;3
Hybrid Data Driven and Rule Based Sentiment Analysis on Greek Text;3
Hybrid deep fault detection and isolation: Combining deep neural networks and system performance models;1
Hybrid deep learning approaches for smartphone sensor-based human activity recognition;3
HYBRID ENSEMBLE APPROACHES TO CLASSIFY IMBALANCED DATA;1
Hybrid ensemble classification of tree genera using airborne LiDAR data;1
Hybrid ensemble classifier for stream data;37
Hybrid evolutionary algorithms for classification data mining;1
Hybrid extreme rotation forest;1
Hybrid Feature Selection and Ensemble Learning Method for Spam Email Classification;4
Hybrid feature selection methods for online biomedical publication classification;1
Hybrid features and mediods classification based robust segmentation of blood vessels;1
Hybrid firefly based simultaneous gene selection and cancer classification using support vector machines and random forests;1
Hybrid Forest: A Concept Drift Aware Data Stream Mining Algorithm;21
Hybrid Fuzzy C-means CPD-based Segmentation for Improving Sensor-based Multi-resident Activity Recognition;2
Hybrid incremental learning of new data and new classes for hand-held object recognition;1
Hybrid indoor location: Simultaneous zone and coordinates based location for AAL environments with 802.11 fingerprinting technology;1
Hybrid Machine Learning System for Solving Fraud Detection Tasks;4
Hybrid Method for Sentiment Analysis Using Homogeneous Ensemble Classifier;4
Hybrid Method in Identifying the Fraud Detection in the Credit Card;2
Hybrid Multi-Level Credit Card Fraud Detection System by Bagging Multiple Boosted Trees (BMBT);7
Hybrid One-Class Ensemble for High-Dimensional Data Classification;1
Hybrid parallel linguistic fuzzy rules with canopy mapreduce for big data classification in cloud;2
Hybrid Predictive Model: When an Interpretable Model Collaborates with a Black-box Model;2
Hybrid Relabeled Model for Network Intrusion Detection;2
Hybrid short term prediction to address limited timeliness of public transport data streams;57
Hybrid SMOTE-ensemble approach for software defect prediction;6
