Performance assessment on spatial data by the development of Classification Techniques using P-Tree subspace method;2
Performance comparison of classifiers on reduced phishing website dataset;1
Performance comparison of different classification algorithms for household poverty classification;1
Performance comparison of random forests and extremely randomized trees;1
Performance comparison of support vector machine, random forest, and extreme learning machine for intrusion detection;4
Performance Envelopes of Adaptive Ensemble Data Stream Classifiers;51
Performance evaluation of data mining techniques;1
Performance evaluation of data mining techniques in steel manufacturing industry;1
Performance Evaluation of Ensemble-Based Machine Learning Techniques for Prediction of Chronic;1
Performance evaluation of ensemble-based machine learning techniques for prediction of chronic kidney disease;3
Performance evaluation of GIS-based new ensemble data mining techniques of adaptive neuro-fuzzy inference system (ANFIS) with genetic algorithm (GA), differential evolution (DE), and particle swarm optimization (PSO) for landslide spatial modelling;1
Performance Evaluation Of Hepatitis Diagnosis Using Single and Multi-Classifiers Fusion;1
Performance Evaluation of Random Forests and Artificial Neural Networks for the Classification of Liver Disorder;1
Performance Evaluation of RF and SVM for Sugarcane Classification Using Sentinel-2 NDVI Time-Series;3
Performance evaluation of the GIS-based data mining techniques of best-first decision tree, random forest, and na‹ve Bayes tree for landslide susceptibility modeling;1
Performance evaluation of the GIS-based data-mining techniques decision tree, random forest, and rotation forest for landslide susceptibility modeling;4
Performance Evaluation of Tree Ensemble Classification Models Towards Challenges of Big Data Analytics;1
Performance measures for evolving predictions under delayed labelling classification;34
Performance metrics for model fusion in twitter data drifts;10
Performance Modeling and Multi-Objective Optimization for Data Analytics in the Cloud;3
Performance prediction of roadheaders using ensemble machine learning techniques;4
Performance Prediction Using Classification;9
Performance-constrained binary classification using ensemble learning: an application to cost-efficient targeted PrEP strategies;1
Performance-weighted ensembles of random forests for predicting price impact;1
Performance-weighted-voting model: an ensemble machine learning method for cancer type classification using whole-exome sequencing mutation;1
Performing Binary Classification of Contests Profitability for Draftkings;1
Permeability prediction of petroleum reservoirs using stochastic gradient boosting regression;2
Persian handwritten digit recognition by random forest and convolutional neural networks;1
Persistent Anytime Learning of Objects from Unseen Classes;1
Person Identification Using Pose-Based Hough Forests from Skeletal Action Sequence;1
Person recognition using smartphones' accelerometer data;3
Personalisation in multi-day GPS and accelerometer data processing;1
Personality research and assessment in the era of machine learning;19
Personalization and Optimization of Decision Parameters via Heterogenous Causal Effects;3
Personalized maneuver prediction at intersections;10
Personalized Online Learning of Whole-Body Motion Classes Using Multiple Inertial Measurement Units;21
Personalized Online Learning with Pseudo-Ground Truth;20
Personalized Predictive Modeling in Type 1 Diabetes;5
Personalized Quality of Experience (QOE) Management using Data Driven Architecture in 5G Wireless Networks;1
Personalized sleep parameters estimation from actigraphy: a machine learning approach;1
Personalized Treatment through Biosensors and Machine Learning ML;1
Perspectives on data?driven soil research;1
Perturbation-Based Explanations of Prediction Models;11
Pervasive Sensing;1
Petroleum analytics learning machine to forecast production in the wet gas marcellus shale;1
PFP-RFSM: protein fold prediction by using random forests and sequence motifs;4
PG 594: Big Data;10
PGNBC: Pearson Gaussian Na‹ve Bayes classifier for data stream classification with recurring concept drift;56
Phase contrast cell detection using multilevel classification;1
PhD Presentation:?On data-driven systems analyzing, supporting and enhancing users? interaction and experience?;1
Phenotypic image analysis software tools for exploring and understanding big image data from cell-based assays;3
Phishing Detection using Random Forest, SVM and Neural Network with Backpropagation;1
Phishing detection using RDF and random forests.;1
Phishing e-mail filtering mechanism using heuristic technique;1
Phishing Websites Prediction Using Classification Techniques;1
PhishScore: Hacking phishers' minds;1
Phishstorm: Detecting phishing with streaming analytics;1
Phorecasting phishing attacks: A new approach for predicting the appearance of phishing websites;2
Physical Activity Recognition and Identification System;1
Physical Health Test Analysis Based on Adaptive Proportional Fusion Ensemble Classifier for College Students;3
Physician-friendly machine learning: A case study with cardiovascular disease risk prediction;2
Piccett: Protocol-independent classification of corrupted error-tolerant traffic;1
PigLeg: prediction of swine phenotype using machine learning;1
PIP-EL: A new ensemble learning method for improved proinflammatory peptide predictions;1
Pitfalls Analyzer: Quality Control for Model-Driven Data Science Pipelines;1
Planning Group Meals Based on Preferences of Attendees;1
Player identification from RTS game replays;1
Playing Games to Reduce Supervision in Learning;2
Playing with the data: what legal scholars should learn about machine learning;3
Point-based classification of power line corridor scene using random forests;1
Pointhop: An explainable machine learning method for point cloud classification;1
Political Disaffection: a case study on the Italian Twitter community;1
Pollen Grain Classification using Geometrical and Textural Features;3
Pollen recognition using a multi-layer hierarchical classifier;1
Popularity prediction of images and videos on Instagram;4
Popularity Prediction of Social Multimedia Based on Concept Drift;9
Positioning Using Classification and Regression: Case study of Oman Sea;1
Positive-unlabeled ensemble learning for kinase substrate prediction from dynamic phosphoproteomics data;3
Post-disturbance transient stability assessment of power systems by a self-adaptive intelligent system;3
Potential of hyperspectral metrics and classifiers for mapping Brazilian savannas in the rainy and dry seasons;1
Potential of RT, Bagging and RS ensemble learning algorithms for reference evapotranspiration prediction using climatic data-limited humid region in Bangladesh;1
Power of time window in predicting hashtags while typing a tweet;7
Power plant performance modeling with concept drift;10
Power quality disturbances classification using rotation forest and multi-resolution fast S-transform with data compression in time domain;3
Power System On-line Transient Stability Prediction by Margin Indices and Random Forests;1
Power Transformer Failure Prediction: Classification in Imbalanced Time Series;1
PPCM: Combing multiple classifiers to improve protein-protein interaction prediction;3
Practical Evaluation of Out-of-Distribution Detection Methods for Image Classification;4
Practical machine learning;2
Practical Machine Learning with Python;1
Practical Machine Learning with Python: A Problem-Solver's Guide to Building Real-World Intelligent Systems;1
Praxiseinstieg Machine Learning mit Scikit-Learn und TensorFlow: Konzepte, Tools und Techniken fr intelligente Systeme;1
Precipitation estimates from MSG SEVIRI daytime, nighttime, and twilight data with random forests;1
PredHS: a web server for predicting protein?protein interaction hot spots by using structural neighborhood properties;1
Pre-Diagnosis of Chronic Diseases by the Application of Computational Intelligence Models;3
Predi‡Æo do desempenho acadˆmico de graduandos utilizando minera‡Æo de dados educacionais;1
Predict and intervene: Addressing the dropout problem in a MOOC-based program;1
Predict Survival of Patients with Lung Cancer Using an Ensemble Feature Selection Algorithm and Classification Methods in Data Mining;1
Predict the trend of stock prices using machine learning techniques;2
Predictability of Financial Markets in ASEAN Countries using Machine Learning Techniques;4
Predicting a multi-parametric probability map of active tumor extent using random forests;1
Predicting abandonment in online coding tutorials;3
Predicting academic performance based on learner traces in a social learning environment;1
Predicting academic performance of students from VLE big data using deep learning models;1
Predicting academic success in higher education: literature review and best practices;3
Predicting academic success through students? interaction with Version Control Systems;3
Predicting Account Receivables with Machine Learning;3
Predicting achievement and providing support before STEM majors begin to fail;1
Predicting all star player in the national basketball association using random forest;1
Predicting and improving invoice-to-cash collection through machine learning;3
Predicting and interpolating state?level polls using Twitter textual data;1
Predicting ATP-Binding Cassette Transporters Using the Random Forest Method;1
Predicting at-Risk Students at Different Percentages of Course Length for Early Intervention Using Machine Learning Models;1
Predicting at-risk university students in a virtual learning environment via a machine learning algorithm;3
Predicting battery depletion of neighboring wireless sensor nodes;1
Predicting Behavior Trends among Students Based on Personality Traits;1
Predicting Bike-Sharing Traffic Flow using Machine Learning;1
Predicting Bond Strength of FRP Bars in Concrete Using Soft Computing Techniques;3
Predicting breast cancer metastasis by using serum biomarkers and clinicopathological data with machine learning technologies;2
Predicting bucket-filling control actions of a wheel-loader operator using a neural network ensemble;1
Predicting carbon dioxide and energy fluxes across global FLUXNET sites with regression algorithms;1
Predicting Career Using Data Mining;1
Predicting Categorical Information for New Content in Application Recommender Systems;1
Predicting Churn using Hybrid Supervised-Unsupervised Models;5
Predicting Cognitive Load in Future Code Puzzles;1
Predicting commercial intent of online consumers using machine learning techniques;3
Predicting Computing Prices Dynamically Using Machine Learning;1
Predicting concept drift via dynamic Na‹ve Bayes;4
Predicting Credit Card Fraud on a Imbalanced Data;2
Predicting Credit Risk at Application Stage;3
Predicting crowdfunding success with optimally weighted random forests;1
Predicting Customer Churn in the Telecom Industry Using Data Analytics;4
Predicting Customer Retention of an App-Based Business Using Supervised Machine Learning;3
Predicting cyberbullying on social media in the big data era using machine learning algorithms: Review of literature and open challenges;6
Predicting dangerous seismic activity with recurrent neural networks;1
Predicting Delivery Time of Components in a Supply Chain;1
Predicting diabetes mellitus using SMOTE and ensemble machine learning approach: The Henry Ford ExercIse Testing (FIT) project;4
Predicting direct marketing response in banking: comparison of class imbalance methods;2
Predicting disease risks using feature selection based on random forest and support vector machine;4
Predicting disruptive instabilities in controlled fusion plasmas through deep learning;4
Predicting DNase I hypersensitive sites via un-biased pseudo trinucleotide composition;1
Predicting dropout student: an application of data mining methods in an online education program;3
Predicting drug? disease associations via sigmoid kernel-based convolutional neural networks;2
Predicting Drug Interactions and Mutagenicity with Ensemble Classifiers on Subgraphs of Molecules;3
Predicting Drug Target Interactions Using Dimensionality Reduction with Ensemble Learning;2
Predicting drug-disease associations via using gaussian interaction profile and kernel-based autoencoder;2
Predicting drug-target interactions using Lasso with random forest based on evolutionary information and chemical structure;2
Predicting Eucalyptus spp. stand volume in Zululand, South Africa: an analysis using a stochastic gradient boosting regression ensemble with multi-source data sets;3
Predicting exploit likelihood for cyber vulnerabilities with machine learning;3
Predicting faults in high performance computing systems: An in-depth survey of the state-of-the-practice;3
Predicting Financial Markets using Text on the Web;4
Predicting fluid intelligence in adolescent brain mri data: An ensemble approach;1
Predicting Future Alleviation of Mental Illness in Social Media: An Empathy-Based Social Network Perspective;1
Predicting Gaps in Usage in a Phone-Based Literacy Intervention System;3
Predicting gene functions from multiple biological sources using novel ensemble methods;3
Predicting Generalized Anxiety Disorder among women using random forest approach;4
Predicting good configurations for GitHub and stack overflow topic models;1
Predicting health outcomes from high?dimensional longitudinal health histories using relational random forests;1
Predicting High-Magnitude, Low-Frequency Crop Losses Using Machine Learning;1
Predicting hospital and emergency department utilization among community-dwelling older adults: Statistical and machine learning approaches;1
Predicting Hourly $\mathbf {PM} _ {2.5} $ Concentrations Based on Random Forest and Ensemble Neural Network;1
Predicting in-hospital mortality of patients with acute kidney injury in the ICU using random forest model;2
Predicting inpatient length of stay after brain tumor surgery: Developing machine learning ensembles to improve predictive performance;1
Predicting Judicial Decisions: A Statistically Rigorous Approach and a New Ensemble Classifier;3
Predicting knowledge level of learners using Machine Learning Algorithms;6
Predicting Learner Knowledge Level In? e E-learning Environment;3
Predicting Learning Behavior Using A Unified Framework: Looking Beyond the Clicks;3
Predicting LncRNA-miRNA Interactions via Network Embedding with Integrated Structure and Attribute Information;1
Predicting lung cancer survivability using ensemble learning methods;1
Predicting malignant nodules from screening CT scans;3
Predicting Market Basket Additions as a Way to Enhance Customer Service Levels;1
Predicting matches in international football tournaments with random forests;1
Predicting more from less: Synergies of learning;4
Predicting National Basketball Association Game Outcomes Using Ensemble Learning Techniques;1
Predicting Node Failures in an Ultra-large-scale Cloud Computing Platform: an AIOps Solution;3
Predicting of Traffic Loads by the Help of Climate Data Using Data Mining;2
Predicting online video engagement using clickstreams;3
Predicting outcome of endovascular treatment for acute ischemic stroke: potential value of machine learning algorithms;1
Predicting outcomes of a content driven process instance execution;1
Predicting parking space availability based on heterogeneous data using Machine Learning techniques;4
Predicting particle accelerator failures using binary classifiers;2
Predicting particulate matter for assessing air quality in Delhi using meteorological features;1
Predicting pediatric surgical durations;1
Predicting petroleum reservoir properties from downhole sensor data using an ensemble model of neural networks;4
Predicting post severity in mental health forums;1
Predicting protein-protein interactions from matrix-based protein sequence using convolution neural network and feature-selective rotation forest;2
Predicting pulsar stars using a random tree boosting voting classifier (RTB-VC);3
Predicting rating polarity through automatic classification of review texts;1
Predicting relevance of change recommendations;4
Predicting retention among application users with online ensemble learning models;35
PREDICTING RISK OF BUYING LOW QUALITY CAR WITH RAPID MINER;1
Predicting school performance using a combination of traditional and non-traditional education data from South Africa;3
Predicting Search Queries Based on Personal Routines;1
Predicting seismic-induced liquefaction through ensemble learning frameworks;4
Predicting sentiment toward transportation in social media using visual and textual features;3
Predicting service metrics for cluster-based services using real-time analytics;9
Predicting service metrics from device statistics in a container-based environment;30
Predicting short-term Bitcoin price fluctuations from buy and sell orders;4
predicting Short-term Survival after Liver transplantation using Machine Learning;3
Predicting skill from gameplay input to a first-person shooter;1
Predicting social response to infectious disease outbreaks from internet-based news streams;1
Predicting software maintainability using ensemble techniques and stacked generalization;3
Predicting split decisions of coding units in HEVC video compression using machine learning techniques;3
Predicting start-up success with machine learning;7
Predicting stock market trends using random forests: A sample of the Zagreb stock exchange;1
Predicting Stock Price Falls Using News Data: Evidence from the Brazilian Market;3
Predicting stock returns of mid cap firms in India?an application of random forest and dynamic evolving neural fuzzy inference system;1
Predicting Stress in Teens from Wearable Device Data Using Machine Learning Methods;3
Predicting Student Degree Completion using Random Forest;1
Predicting student dropout in subscription-based online learning environments: The beneficial impact of the logit leaf model;3
Predicting student dropout: A machine learning approach;3
Predicting student failure at school using genetic programming and different data mining approaches with high dimensional and imbalanced data;1
Predicting Student Performance Using Data Mining and Learning Analytics Techniques: A Systematic Literature Review;3
Predicting student success in a blended learning environment;3
Predicting Students' Grades Using CART, ID3, and Multiclass SVM Optimized by the Genetic Algorithm (GA): A Case Study;3
Predicting students' happiness from physiology, phone, mobility, and behavioral data;1
Predicting Students Performance in Online Courses using Classification Techniques;3
Predicting Students? Academic Performance and Main Behavioral Features Using Data Mining Techniques;1
Predicting students? academic performance by using educational big data and learning analytics: evaluation of classification methods and learning logs;3
Predicting students? academic procrastination in blended learning course using homework submission data;1
Predicting Subjective Measures of Social Anxiety from Sparsely Collected Mobile Sensor Data;3
Predicting success: an application of data mining techniques to student outcomes;1
Predicting successes and failures of clinical trials with an ensemble LS-SVR;1
Predicting surface fuel models and fuel metrics using Lidar and CIR imagery in a dense, mountainous forest;2
Predicting tachycardia as a surrogate for instability in the intensive care unit;1
Predicting Tennis Match Outcomes with Network Analysis and Machine Learning;3
Predicting Termination of Mobile Subscribers Using Classification Algorithms;3
Predicting the Causal Effect Relationship Between COPD and Cardio Vascular Diseases;1
Predicting the decrease of engagement indicators in a MOOC;2
Predicting the direction of stock market prices using tree-based classifiers;1
Predicting the direction, maximum, minimum and closing price of daily/Intra-daily bitcoin exchange rate using batch and online machine learning techniques;4
Predicting the Future is like Completing a Painting!;3
Predicting the Infinite Dilution Activity Coefficient with Machine Learning;1
Predicting the listing statuses of Chinese-listed companies using decision trees combined with an improved filter feature selection method;2
Predicting the Result of a Cricket Match by Applying Data Mining Techniques;1
Predicting the ripening of papaya fruit with digital imaging and random forests;1
Predicting the Risk of Attrition for Undergraduate Students with Time Based Modelling.;1
Predicting the Severity of Closed Source Bug Reports Using Ensemble Methods;4
Predicting the structural condition of individual sanitary sewer pipes with random forests;1
Predicting the traction power of metropolitan railway lines using different machine learning models;3
Predicting transplant and patient survival following liver transplantation using machine learning;1
Predicting University Students' Grades Based on Previous Academic Achievements;3
Predicting user churn on streaming services using recurrent neural networks;1
Predicting Users' Personality from Instagram Pictures: Using Visual and/or Content Features?;1
Predicting users? political support from their Reddit comment history;1
Predicting Visual Fixation on Digital Advertisement using Machine Learning;2
Predicting wetland distribution changes under climate change and human activities in a mid-and high-latitude region;2
Predicting xerostomia after IMRT treatments: a data mining approach;1
Prediction analysis of risky credit using Data mining classification models;1
Prediction and analysis of cell-penetrating peptides using pseudo-amino acid composition and random forest models;3
Prediction and causal analysis of defects in steel products: Handling nonnegative and highly overdispersed count data;1
Prediction and Detection of Freezing of Gait in Parkinson's Disease using Plantar Pressure Data;1
PREDICTION AND FEATURE REDUCTION USING NON PARAMETRIC DATA MINING TECHNIQUES.;2
Prediction and knowledge mining of outdoor atmospheric corrosion rates of low alloy steels based on the random forests approach;1
Prediction and prioritization of rare oncogenic mutations in the cancer Kinome using novel features and multiple classifiers;1
Prediction Confidence from Neighbors;1
Prediction for global African swine fever outbreaks based on a combination of random forest algorithms and meteorological data;3
Prediction intervals in supervised learning for model evaluation and discrimination;4
Prediction models for burden of caregivers applying data mining techniques;2
Prediction of a Cell-Class-Specific Mouse Mesoconnectome Using Gene Expression Data;1
Prediction of academic success through interaction with version control systems;3
Prediction of active debt in the State of Pernambuco, Brazil;2
Prediction of Alzheimer?s disease using blood gene expression data;3
Prediction of Antimicrobial Resistance Based on Random Forest Algorithms;2
Prediction of antioxidant proteins using hybrid feature representation method and random forest;2
Prediction of arrival times of freight traffic on US railroads using support vector regression;1
Prediction of Breast Cancer Recurrence Using Ensemble Machine Learning Classifiers;6
Prediction of cardiac arrhythmia type using clustering and regression approach (P-CA-CRA);2
Prediction of caregiver burden in amyotrophic lateral sclerosis: a machine learning approach using random forests applied to a cohort study;1
Prediction of Cervical Cancer Basing on Risk Factors using Ensemble Learning;1
Prediction of death status on the course of treatment in SARS-COV-2 patients with deep learning and machine learning methods;2
Prediction of default payment of credit card clients using Data Mining Techniques;1
Prediction of dengue diabetes and swine flu using random forest classification algorithm;1
Prediction of Diabetic Patient Readmission Using Hybrid Ensemble Learning;1
Prediction of diabetic retinopathy based on a committee of random forests;1
Prediction of drug?target interactions from multi-molecular network based on deep walk embedding model;8
Prediction of early breast cancer patient survival using ensembles of hypoxia signatures;1
Prediction of energy consumption in the buildings using multi-layer perceptron and random forest;2
Prediction of English Premier League Game Using an Ensemble Technique;1
Prediction of extracellular matrix proteins by fusing multiple feature information, elastic net, and random forest algorithm;3
Prediction of forest unit volume based on hybrid feature selection and ensemble learning;1
Prediction of hard rock TBM penetration rate using random forests;1
Prediction of heart disease using random forest and rough set based feature selection;4
Prediction of Human Actions in a Smart Home Using Single and Ensemble of Classifiers;1
Prediction of interface residue based on the features of residue interaction network;1
Prediction of Invoice Payment Status in Account Payable Business Process;8
Prediction of Late Payment of Invoices in Account Payable Business Process;7
Prediction of learning behavior based on improved random forest algorithm;1
Prediction of liver cancer using random forest ensemble;1
Prediction of low birth weight infants and its risk factors using data mining techniques;2
Prediction of maximum surface settlement caused by earth pressure balance shield tunneling using random forest;1
Prediction of Motor Imagery Tasks from Multi-Channel EEG Data for Brain-Computer Interface Applications;3
Prediction of New Bioactive Molecules of Chemical Compound Using Boosting Ensemble Methods;1
Prediction of novel mouse TLR9 agonists using a random forest approach;2
Prediction of O-glycosylation sites in proteins using PSO-based data balancing and random forest;3
Prediction of O-glycosylation sites using random forest and GA-tuned PSO technique;3
