Title of Study;Frequency in relation to the number of strings search
$$\text {ALR}^ n $$: accelerated higher-order logistic regression;3
(Decision and regression) tree ensemble based kernels for regression and classification;1
. A BAYESIAN HIERARCHICAL TOPOGRAPHIC CLUSTERING METHOD MOTIVATED BY THE SELF-ORGANIZING MAP;18
?Dendrology? in numerical weather prediction: What random forests and logistic regression tell us about forecasting extreme precipitation;1
?Noisy beets?: impact of phenotyping errors on genomic predictions for binary traits in Beta vulgaris;1
10 Computer-Aided Diagnosis;2
10 Ensemble learning of high-dimensional stock market data;3
11C-PIB PET image analysis for Alzheimer's diagnosis using weighted voting ensembles;1
13 Direct Marketing in the;1
13 Learning Analytics;1
15-Machine Learning, Random Forests, and Boosted Regression Trees;1
18 th ICCRTS;3
1st-degree Atrioventricular (AV-block) and Bundle Branch Block Prediction using Machine Learning;2
2 Mining and Analysis;1
2014 Index IEEE Transactions on Pattern Analysis and Machine Intelligence Vol. 36;1
2014 International Joint Conference on Neural Networks;19
2019 Index IEEE Transactions on Knowledge and Data Engineering Vol. 31;3
2CS: Correlation-Guided Split Candidate Selection in Hoeffding Tree Regressors;54
3D Classification of Power Line Scene Using Airborne Lidar Data;3
3d hand posture recognition from small unlabeled point sets;1
3D human action segmentation and recognition using pose kinetic energy;1
3D iterative spatiotemporal filtering for classification of multitemporal satellite data sets;1
3D mineral prospectivity mapping with random forests: A case study of Tongling, Anhui, China;1
3D object recognition and classification: a systematic literature review;1
4mCpred-EL: an ensemble learning framework for identification of DNA N4-methylcytosine sites in the mouse genome;1
7 Machine Learning on;3
A bagging and importance sampling approach to Support Vector Machines;1
A Bayesian Perspective of Statistical Machine Learning for Big Data;19
A benchmark of data stream classification for human activity recognition on connected objects;9
A benchmarking study of classification techniques for behavioral data;3
A Benchmarking Study of Unsupervised Anomaly Detection Algorithms;7
A big data analytics model for customer churn prediction in the retiree segment;2
A big data architecture for traffic forecasting using multi-source information;1
A Bolasso based consistent feature selection enabled random forest classification algorithm: An application to credit risk assessment;4
A boosting self-training framework based on instance generation with natural neighbors for K nearest neighbor;3
A brief review of random forests for water scientists and practitioners and their recent history in water resources;1
A brief survey on random forest ensembles in classification model;4
A business intelligence platform Implemented in a big data system embedding data mining: a case of study;1
A business zone recommender system based on Facebook and urban planning data;1
A CAD $ _ {\bf x} $ Scheme for Mammography Empowered With Topological Information From Clustered Microcalcifications? Atlases;1
A cascade ensemble learning model for human activity recognition with smartphones;1
A case study in text mining of discussion forum posts: Classification with bag of words and global vectors;7
A causal model for short?term time series analysis to predict incoming Medicare workload;3
A churn prediction model for prepaid customers in telecom using fuzzy classifiers;3
A Class Association Rule Based Classifier Using Probability Density Functions for Intrusion Detection Systems;1
A class imbalance learning approach to fraud detection in online advertising;2
A Classification Method based on Multi-decision Framework Using Regression Model;1
A classification model for incomplete Internet of Things sensor data in decision-making;1
A Classification of ECG arrhythmia analysis based on performance factors using machine learning approach;3
A Classification Scheme Based on Directed Acyclic Graphs for Acoustic Farm Monitoring;4
A classification tree for functional data;1
A classifier using online bagging ensemble method for big data stream learning;36
A clinical risk stratification tool for predicting treatment resistance in major depressive disorder;3
A Cloud-based Analytics Architecture for the Application of Online Machine Learning Algorithms on Data Streams in Consumer-centric Internet of Things Domains.;1
A cloud-based flexible solution for psychometric tests validation, administration and evaluation;2
A cloud-based multi-temporal ensemble classifier to map smallholder farming systems;1
A cloud-to-edge approach to support predictive analytics in robotics industry;9
A clustering and ensemble based classifier for data stream classification;32
A clustering approach for feature selection in microarray data classification using random forest;1
A clustering based variable sub-window approach using particle swarm optimisation for biomedical sensor data monitoring;8
A cognitive?emotional biomarker for predicting remission with antidepressant medications: a report from the iSPOT-D trial;3
A combination of PSO-based feature selection and tree-based classifiers ensemble for intrusion detection systems;1
A combined PFCM and recurrent neural network-based intrusion detection system for cloud environment;1
A Comparative Analysis of Classification Algorithms on Weather Dataset Using Data Mining Tool;1
A comparative analysis of data preparation algorithms for customer churn prediction: A case study in the telecommunication industry;3
A Comparative Analysis of Ensemble Based Machine Learning Techniques for Diabetes Identification;2
A comparative analysis of ensemble classifiers: case studies in genomics;4
A comparative analysis of enzyme classification approaches using hybrid feature selection technique;4
A comparative analysis of machine learning models for quality pillar assessment of SaaS services by multi-class text classification of users? reviews;8
A comparative analysis of tree-based ensemble methods for detecting imminent lane change maneuvers in connected vehicle environments;1
A Comparative Analysis of Tree-based Machine Learning Algorithms for Breast Cancer Detection;2
A comparative analysis of various classification trees;11
A comparative assessment of canonical correlation forest, random forest, rotation forest and logistic regression methods for landslide susceptibility mapping;3
A comparative assessment of decision trees algorithms for flash flood susceptibility modeling at Haraz watershed, northern Iran;3
A comparative assessment of GIS-based data mining models and a novel ensemble model in groundwater well potential mapping;1
A Comparative Assessment of Machine-Learning Techniques for Land Use and Land Cover Classification of the Brazilian Tropical Savanna Using ALOS-2/PALSAR-2 Polarimetric Images;1
A comparative assessment of support vector regression, artificial neural networks, and random forests for predicting and mapping soil organic carbon stocks across an Afromontane landscape;1
A comparative assessment of the performance of ensemble learning in customer churn prediction.;3
A comparative evaluation of anomaly detection techniques on multivariate time series data;3
A comparative evaluation of automated solar filament detection;2
A comparative evaluation of the generalised predictive ability of eight machine learning algorithms across ten clinical metabolomics data sets for binary classification;1
A comparative evaluation of unsupervised deep architectures for intrusion detection in sequential data streams;3
A Comparative Performance Assessment of Ensemble Learning for Credit Scoring;3
A Comparative Performance Evaluation of Classification Algorithms for Clinical Decision Support Systems;3
A Comparative Performance of Classification Algorithms in Predicting Alcohol Consumption Among Secondary School Students;3
A Comparative Result Analysis of Human Cancer Diagnosis using Ensemble Classification Methods;3
A comparative study of cancer classification methods using microarray gene expression profile;4
A comparative study of classification methods for traffic signs recognition;1
A comparative study of data mining algorithms for decision tree approaches using weka tool;9
A comparative study of data mining algorithms for high detection rate in intrusion detection system;1
A comparative study of ensemble methods for students' performance modeling;4
A Comparative Study of Ensemble Techniques and Individual Classifiers in Predicting Insurance Claim;3
A comparative study of FFT, DCT, and DWT for efficient arrhytmia classification in RP-RF framework;2
A Comparative Study of Link Prediction Algorithms For Social Networks of Varying Sizes;3
A comparative study of machine learning models for predicting the state of reactive mixing;1
A comparative study of Named Entity Recognition for Arabic using ensemble learning approaches;1
A Comparative Study of Random Forest & K-Nearest Neighbors on HAR dataset Using Caret;1
A Comparative Study of Random Forest and Its Probabilistic Variant;1
A comparative study of social bot classification techniques;4
A comparative study of some classification algorithms using WEKA and LAD algorithm;1
A Comparative Study of the Classification Algorithms Based on Feature Selection;1
A comparative study of the effect of sensor noise on activity recognition models;10
A Comparative Study on Crime in Denver City Based on Machine Learning and Data Mining;1
A comparative study on decision tree and random forest using R tool;1
A Comparative Study on Fake Job Post Prediction Using Different Data mining Techniques;3
A Comparative Study on Heart Disease Prediction Using Data Mining Techniques and Feature Selection;3
A Comparative Study on Serial Decision Tree Classification Algorithms in Text Mining;4
A Comparative Study on Traditional Data Mining and Big Data Mining Classification Algorithms;5
A comparative study: classification vs. user-based collaborative filtering for clinical prediction;1
A comparison among support vector machine and other machine learning classification algorithms;21
A comparison between decision tree and random forest in determining the risk factors associated with type 2 diabetes;1
A Comparison between Different Classifiers for Diagnoses of Atrial Fibrillation;2
A comparison of classification algorithms using Landsat-7 and Landsat-8 data for mapping lithology in Canada?s Arctic;1
A comparison of classification methods across different data complexity scenarios and datasets;3
A comparison of classification methods for gene prediction in metagenomics;4
A COMPARISON OF CLASSIFIERS FOR MUSICAL GENRES CLASSIFICATION AND MUSIC EMOTION RECOGNITION;3
A comparison of classifiers for predicting the class color of fluorescent proteins;2
A comparison of data mining techniques and multi-sensor analysis for inland marshes delineation;2
A comparison of data mining techniques for suicide attempt characteristics mapping and prediction;1
A comparison of data mining techniques in evaluating retail credit scoring using R programming;1
A Comparison of Data Sampling Techniques for Credit Card Fraud Detection;3
A comparison of data-driven approaches for mobile marketing user conversion prediction;9
A comparison of deep learning and hand crafted features in medical image modality classification;4
A comparison of different remotely sensed data for classifying bedrock types in Canada?s Arctic: application of the robust classification method and random forests;1
A comparison of evolved linear and non-linear ensemble vote aggregators;1
A Comparison of Four Algorithms for Land-Use Classification Based on Landsat 8 OLI Image;1
A Comparison of Machine Learning Algorithms and their Applications.;3
A comparison of machine learning algorithms for forecasting indoor temperature in smart buildings;1
A comparison of machine learning algorithms for proactive hard disk drive failure detection;1
A comparison of machine learning model validation schemes for non-stationary time series data;3
A comparison of methods for link sign prediction with signed network embeddings;1
A comparison of R, SAS, and Python implementations of random forests;1
A comparison of random forest based algorithms: random credal random forest versus oblique random forest;1
A comparison of random forest methods for solving the problem of pulsar search;1
A comparison of sentiment analysis techniques in a parallel and distributed NoSQL environment;4
A comparison of supervised learning schemes for the detection of search and rescue (SAR) vessel patterns;1
A comparison of the performance of some extreme learning machine empirical models for predicting daily horizontal diffuse solar radiation in a region of southern Iran;1
A Comparison Study of Credit Card Fraud Detection: Supervised versus Unsupervised;9
A comparison study on active learning integrated ensemble approaches in sentiment analysis;3
A comparison study on ensemble strategies and feature sets for sentiment analysis;10
A Comparison the Effectiveness of Data Mining Techniques in Predicting Career Advice to Promote Education for People with Disabilities (Thailand);1
A Complete Bibliography of Publications in Fundamenta Informaticae:(2010?2019);1
A composite classification model for web services based on semantic & syntactic information integration;3
A comprasion of ensemble learning methods in retail sales forecasting;2
A comprehensive active learning method for multiclass imbalanced data streams with concept drift;43
A Comprehensive Analysis of Architectures and Methods of Real-Time Big Data Analytics;2
A comprehensive analysis on risk prediction of acute coronary syndrome using machine learning approaches;3
A Comprehensive Analysis on Undergraduate Student Academic Performance using Feature Selection Techniques on Classification Algorithms;1
A comprehensive evaluation of ensemble learning for stock-market prediction;3
A comprehensive evaluation of multicategory classification methods for microbiomic data;1
A Comprehensive Evaluation of Webpage Content Features for Detecting Malicious Websites;1
A comprehensive medical decision?support framework based on a heterogeneous ensemble classifier for diabetes prediction;10
A comprehensive method for attribute space extension for random forest;1
A comprehensive review and open challenges of stream big data;19
A comprehensive review of conditional random fields: variants, hybrids and applications;3
A comprehensive study of activity recognition using accelerometers;3
A comprehensive study on mid-level representation and ensemble learning for emotional analysis of video material;1
A Comprehensive Survey for Intelligent Spam Email Detection;7
A Comprehensive Survey of Spam Profile Detection Methods in Online Social Networks;4
A comprehensive survey on machine learning techniques and user authentication approaches for credit card fraud detection;4
A comprehensive survey on support vector machine classification: Applications, challenges and trends;18
A Computational Pipeline to Improve Clinical Alarms Using a Parallel Computing Infrastructure;2
A computationally fast variable importance test for random forests for high-dimensional data;1
A Computer Aided System to Discriminate Enhanced Colon Images by Three Data Mining Methods;2
A conformal prediction inspired approach for distribution regression with random Fourier features;1
A Context-Sensitive Framework for Mining Concept Drifting Data Streams;64
A convolutional neural network for ECG annotation as the basis for classification of cardiac rhythms;2
A copula-based supervised learning classification for continuous and discrete data;3
A cost effective solution for audio surveillance using embedded devices as part of a cloud infrastructure;4
A cost-sensitive three-way combination technique for ensemble learning in sentiment classification;1
A cost-sensitive weighted random forest technique for credit card fraud detection;3
A coupling support vector machines with the feature learning of deep convolutional neural networks for classifying microarray gene expression data;1
A critical analysis of Sampling Techniques for imbalanced data classification: An application to Social Media;4
A Critical Analysis of Twitter Data for Movie Reviews Through ?Random Forest?Approach;1
A CRITICAL EXPLORATION OF THE POTENTIAL UTILITY OF RULE INDUCTION DATA MINING METHODS TO ?ORTHODOX? EDUCATION RESEARCH;2
A crowdsource-based sensing system for monitoring fine-grained air quality in urban environments;4
A Customized Deep Neural Network Approach to Investigate Travel Mode Choice with Interpretable Utility Information;3
A cybernetic systems approach to abnormality detection in retina images using case based reasoning;2
A dashboard-based predictive process monitoring engine;4
A Data Imputation Model based on an Ensemble Scheme;1
A data mining approach for global burned area mapping;1
A data mining approach for lubricant-based fault diagnosis;1
A Data Mining Approach for secure Cloud using Enhanced Random Forest;1
A Data Mining Approach Identified Salivary Biomarkers That Discriminate between Two Obesity Measures;1
A data mining approach to ontology learning for automatic content-related question-answering in MOOCs.;3
A data mining approach to predict undergraduate students' performance;2
A Data Mining Based Approach to Predict Autism Spectrum Disorder Considering Behavioral Attributes;1
A data mining based system for credit-card fraud detection in e-tail;1
A Data Mining Framework to Model Consumer Indebtedness with Psychological Factors;2
A Data Mining Method for Students' Behavior Understanding.;3
A data mining tool for predicting student withdrawal;3
A Data-Driven Analytical Framework of Estimating Multimodal Travel Demand Patterns using Mobile Device Location Data;1
A data-driven approach to predicting diabetes and cardiovascular disease with machine learning;5
A Data-Driven Approach to the Fragile Families Challenge: Prediction through Principal-Components Analysis and Random Forests;1
A data-driven design for fault detection of wind turbines using random forests and xgboost;4
A data-driven framework for identifying high school students at risk of not graduating on time;3
A data-driven hybrid control framework to improve transit performance;2
A data-mining model for protection of FACTS-based transmission line;1
A DDoS Attack Detection Method Based on Machine Learning;2
A debiased MDI feature importance measure for random forests;1
A decision model for data mining techniques;1
A Decision Support System for Managing Electricity Demand Using an Incrementally Optimized Very Fast Decision Tree Ensemble;1
A decision support system to improve medical diagnosis using a combination of k-medoids clustering based attribute weighting and SVM;1
A Decision Tree Algorithm Combined with Linear Regression for Data Classification;5
A decision tree framework for spatiotemporal sequence prediction;3
A decision tree logic based recommendation system to select software fault prediction techniques;2
A decomposition of the outlier detection problem into a set of supervised learning problems;4
A Deep Convolutional Neural Network Learning Transfer to SVM-Based Segmentation Method for Brain Tumor;4
A deep learning enabled subspace spectral ensemble clustering approach for web anomaly detection;3
A Deep learning toolkit for high dimensional sequential data;1
A deep multi-source adaptation transfer network for cross-subject electroencephalogram emotion recognition;1
A deep neural network model using random forest to extract feature representation for gene expression data classification;1
A Deformable Part Model for One-Shot Object Tracking;2
A Densely-Deployed, High Sampling Rate, Open-Source Air Pollution Monitoring WSN;1
A DETALED DTUDY ON EMAIL SPAM FILTERING TECHNIQUES;3
A Development Environment to Integrate Big Data with Deep Learning;2
A discrete wavelet transform approach to fraud detection;4
A Discretization-based Ensemble Learning Method for Classification in High-Speed Data Streams;37
A Distributed Ensemble of Deep Convolutional Neural Networks with Random Forest for Big Data Sentiment Analysis;1
A distributed tree-based ensemble learning approach for efficient structure prediction of protein;1
A Divide-and-Conquer-Based Ensemble Classifier Learning by Means of Many-Objective Optimization;9
A domain-feature enhanced classification model for the detection of Chinese phishing e-Business websites;3
A domain-independent, transferable and timely analysis approach to assess student collaboration;1
A Drug Target Interaction Prediction Based on LINE-RF Learning;1
A dual attentive neural network framework with community metadata for answer selection;1
A dynamic boosted ensemble learning method based on random forest;1
A Dynamic Ensemble Learning Algorithm based on K-means for ICU mortality prediction;1
A dynamic ensemble learning framework for data stream analysis and real-time threat detection;12
A dynamic financial distress forecast model with multiple forecast results under unbalanced data environment;22
A Dynamic Financial Distress Forecast Model with Time-Weighting Based on Random Forest;7
A Dynamic Model for Traffic Flow Prediction Using Improved DRN;1
A dynamically adaptive movie occupancy forecasting system with feature optimization;1
A Fast and Accurate Threat Detection and Prevention Architecture using Stream Processing;1
A fast machine learning approach to facilitate the detection of interictal epileptiform discharges in the scalp electroencephalogram;2
A fast machine learning workflow for rapid phenotype prediction from whole shotgun metagenomes;1
A feasibility study of autonomically detecting in-process cyber-attacks;4
A Feature Extraction Method for Credit Card Fraud Detection;1
A feature-fusion framework of clinical, genomics, and histopathological data for METABRIC breast cancer subtype classification;1
A Fine Tuned Model of Grasshopper Optimization Algorithm with Classifiers for Optimal Text Classification;1
A fine-grained random forests using class decomposition: an application to medical diagnosis;4
A fixed-point online kernel principal component extraction algorithm;1
A Flexible Approach for Human Activity Recognition Based on Broad Learning System;2
A fog based load forecasting strategy based on multi-ensemble classification for smart grids;10
A Forest height estimation algorithm based on the random forests leaf mean encoding;1
A forest of trees with principal direction specified oblique split on random subspace;3
A fourier spectral pattern analysis to design credit scoring models;10
A Framework for Detecting and Tracking Religious Abuse in Social Media;1
A Framework for Effective Big data Analytics for Decision Support Systems;1
A framework for event classification in tweets based on hybrid semantic enrichment;4
A Framework for in-Network QoE Monitoring of Encrypted Video Streaming;1
A framework for learning and embedding multi-sensor forecasting models into a decision support system: A case study of methane concentration in coal mines;21
A framework for modelling and reasoning about Lone Actor Terrorism;4
A framework for probabilistic segmentation of continuous sensor signals;1
A framework for semantic image annotation using LEGION algorithm;5
A framework to combine three remotely sensed data sources for vegetation mapping in the central Florida Everglades;1
A framework to decompose and develop metafeatures;10
A framework towards the unification of ensemble classification methods;4
A frequency-based gene selection method with random forests for gene data analysis;1
A Frequency-domain-based Pattern Mining for Credit Card Fraud Detection.;4
A frontier: Dependable, reliable and secure machine learning for network/system management;9
A fully automated hybrid human sperm detection and classification system based on mobile-net and the performance comparison with conventional methods;1
A fusion approach to forest disturbance mapping using time series ensemble techniques;1
A Fuzzy Approach for Classification and Novelty Detection in Data Streams Under Intermediate Latency;19
A Fuzzy Approach to User-level Intrusion Detection;3
A fuzzy classification model for myocardial infarction risk assessment;3
A Gap Analysis of Low-Cost Outdoor Air Quality Sensor In-Field Calibration;1
A gender-specific behavioral analysis of mobile device usage data;11
A general approach for predicting the behavior of the Supreme Court of the United States;1
A general framework based on dynamic multi-objective evolutionary algorithms for handling feature drifts on data streams;34
A general guide to applying machine learning to computer architecture;1
A Generalized Flow for B2B Sales Predictive Modeling: An Azure Machine-Learning Approach;2
A generalized multiple classifier system for improving computer-aided classification of breast masses in mammography;1
A Generic Architectural Framework for Machine Learning on Data Streams;68
A genetic algorithm approach for predicting ribonucleic acid sequencing data classification using KNN and decision tree;1
A genetic algorithm approach to optimising random forests applied to class engineered data;4
A genetic programming approach to feature construction for ensemble learning in skin cancer detection;3
A graph-based, semi-supervised, credit card fraud detection system;1
A guidance of data stream characterization for meta-learning;11
A Hermite polynomial algorithm for detection of lesions in lymphoma images;1
A Heterogeneous Ensemble Approach for Activity Recognition with Integration of Change Point-Based Data Segmentation;4
A heterogeneous ensemble learning framework for spam detection in social networks with imbalanced data;1
A heterogeneous ensemble learning voting method for fatigue detection in daily activities;3
A heterogeneous online learning ensemble for non-stationary environments;85
